keywords,answer1,answer2
interpreter,"The Python interpreter is typically found at /usr/local/bin/python3.12 on Unix systems. Adding /usr/local/bin to your shell's search path allows you to start it by typing ""python3.12"". Other locations are possible based on installation choices. On Windows with Python from the Microsoft Store$you can use the python3.12 command or the py.exe launcher. To exit the interpreter$use Control-D on Unix or Control-Z on Windows$or type quit().",Using the Python Interpreter@#- Invoking the Interpreter@#The Python interpreter is usually installed as /usr/local/bin/python3.12 on those machines where it is available; putting /usr/local/bin in your Unix shell’s search path makes it possible to start it by typing the command:@#@#python3.12@#to the shell. [1] Since the choice of the directory where the interpreter lives is an installation option$other places are possible; check with your local Python guru or system administrator. (E.g.$/usr/local/python is a popular alternative location.)@#@#On Windows machines where you have installed Python from the Microsoft Store$the python3.12 command will be available. If you have the py.exe launcher installed$you can use the py command. See Excursus: Setting environment variables for other ways to launch Python.@#@#Typing an end-of-file character (Control-D on Unix$Control-Z on Windows) at the primary prompt causes the interpreter to exit with a zero exit status. If that doesn’t work$you can exit the interpreter by typing the following command: quit().
if Statement$conditions$condition$conditional statements$conditional statement$Control Flow,if statements in Python:@#@#If statements are used to execute different code blocks based on conditions. If a condition is true$the associated block of code is executed; otherwise$it skips to the next condition or the else block if provided.,"In Python$if statements (conditions) are used to execute different blocks of code based on specified conditions. Here's a breakdown:@#@#1)Basic Structure:@#  >>if condition:@#    # Code block to execute if condition is True@#2)Conditions:@#      Conditions are expressions that evaluate to either True or False.@#      Common comparison operators used in conditions include:@#                 == (equal to)@#                 != (not equal to)@#                 < (less than)@#                 > (greater than)@#                 <= (less than or equal to)@#                 >= (greater than or equal to)@#      Conditions can also involve logical operators such as and$or$and not to combine multiple conditions.@#3)Indentation:@#       Indentation is crucial in Python to define blocks of code. The code block following the if statement must be indented.@#       There should be a consistent level of indentation for all statements within the same block.@#4)elif and else:@#       elif (short for ""else if"") is used to check additional conditions if the preceding if statement evaluates to False.@#       else is optional and is used to execute a block of code when none of the preceding if or elif conditions are True.@#Here's an example to illustrate if statements in Python:@#  >>x = 10@#       if x > 0:@#            print(""x is positive"")@#       elif x == 0:@#            print(""x is zero"")@#       else:@#            print(""x is negative"")@#In this example:@#@#The condition x > 0 evaluates to True$so the corresponding print statement executes.@#If x were 0$the condition x == 0 would be True$and the corresponding print statement under elif would execute.@#If none of the conditions are True$the code block under else executes."
for Statement$iteration$iterations$loop$loops$looping,for loops in Python:@#@#For loops are used to iterate over a sequence (like a list or string) and execute a block of code for each item in the sequence. The loop variable takes on the value of each item in turn$allowing you to perform actions or operations on them.," Here's a breakdown of for loops (iterations) in Python:@#@#1)Basic Structure:@#  >>for item in iterable:@#    # Code block to execute for each item in the iterable@#2)Iterables:@#  An iterable is any object that can be looped over.@#  Common examples include lists$tuples$dictionaries$strings$and range objects.@#3)Iteration:@#  The for loop iterates over each item in the iterable sequentially.@#  During each iteration$the loop variable (e.g.$item in the example) takes on the value of the current item in the iterable.@#4)Indentation:@#  Like with if statements$indentation is crucial in defining the block of code to execute within the loop.@#  All statements within the loop should be consistently indented.@#5)Range Function:@#  The range() function is often used to generate a sequence of numbers that the loop iterates over.@#  It can take one$two$or three arguments: start$stop$and step.@#Here's a simple example to illustrate for loops in Python:@#  >>fruits = [""apple""$""banana""$""cherry""]@#      for fruit in fruits:@#            print(fruit)@#@#In this example:@#The loop iterates over each item (""apple""$""banana""$""cherry"") in the fruits list sequentially.@#During each iteration$the loop variable fruit takes on the value of the current item.@#The print(fruit) statement within the loop block prints each fruit on a separate line.@#The output would be:@#apple@#banana@#cherry@#For loops are fundamental in Python for iterating over collections and performing repetitive tasks efficiently."
range() Function$range()$range function,Range function in Python:@#@#The range() function generates a sequence of numbers. You can specify the start$end$and step size to create the sequence. It's commonly used in for loops for iterating over a range of numbers.,The range() function in Python is used to generate a sequence of numbers. Here's a breakdown:@#@#1)Basic Structure:@#  >>range(start$stop$step)@#2)Arguments:@#   start (optional): The starting value of the sequence (default is 0).@#   stop: The end value of the sequence (exclusive).@#   step (optional): The step or increment between each number in the sequence (default is 1).@#3)Return Value:@#   The range() function returns a range object that represents the sequence of numbers.@#   This range object can be used in various contexts$such as iterating in a for loop.@#4)Usage:@#   When used in a for loop$the range() function generates a sequence of numbers that the loop iterates over.@#Here are a few examples of using the range() function:@#  >># Example 1: range(stop)@#        for i in range(5):@#             print(i)  # Output: 0$1$2$3$4@#@#      # Example 2: range(start$stop)@#        for i in range(1$6):@#             print(i)  # Output: 1$2$3$4$5@#@#      # Example 3: range(start$stop$step)@#       for i in range(1$10$2):@#            print(i)  # Output: 1$3$5$7$9@#In each example:@#@#The start parameter specifies the starting value (defaulting to 0 if not provided).@#The stop parameter specifies the end value (exclusive) of the sequence.@#The step parameter specifies the increment between each number in the sequence (defaulting to 1 if not provided).@#The range() function is commonly used in conjunction with for loops to generate sequences of numbers for iteration.
argument$Arguments, Arguments in Python:@#@#Arguments are values passed to functions or methods. They can be positional (in order)$keyword (with names)$or have default values. Functions can also accept arbitrary numbers of arguments using *args and **kwargs.,"In Python$arguments refer to the values that are passed to a function or method when it is called. Here's a breakdown:@#@#1)Positional Arguments:@#   These are arguments that are passed to a function in the order they are defined in the function's parameter list.@#   They are matched to the function parameters based on their position.@#2)Keyword Arguments:@#   These are arguments that are passed to a function with their corresponding parameter names.@#   They allow for more flexibility and clarity in function calls$as the order of arguments doesn't matter.@#3)Default Arguments:@#   These are arguments that have default values specified in the function definition.@#   If a value is not provided for a default argument in the function call$the default value is used.@#4)Arbitrary Arguments:@#   These are arguments that allow a function to accept an arbitrary number of positional or keyword arguments.@#   They are specified using *args for positional arguments and **kwargs for keyword arguments in the function parameter list.@#Here's an example to illustrate different types of arguments:@#  >>def greet(name$message=""Hello""$*args$**kwargs):@#          print(f""{message}${name}!"")@#@#      # Positional and default arguments@#      greet(""Alice"")  # Output: Hello$Alice!@#      greet(""Bob""$""Hi"")  # Output: Hi$Bob!@#@#      # Arbitrary positional and keyword arguments@#      greet(""Charlie""$""Hey""$""Nice to meet you""$mood=""happy"")@#      # Output: Hey$Charlie!@#In this example:@#@#""Alice"" is a positional argument passed to the name parameter$using the default value for message.@#""Bob"" and ""Hi"" are positional arguments passed to name and message parameters$respectively.@#""Charlie"" is a positional argument passed to name$""Hey"" is passed to message$and ""Nice to meet you"" is captured by *args.@#The keyword argument mood=""happy"" is captured by **kwargs."
break,The break statement in Python:@#@#The break statement is used to exit a loop prematurely when a specific condition is met. It immediately terminates the loop and proceeds to the next statement after the loop.,In Python$the break statement is used to exit or terminate a loop prematurely. It is commonly used within loops such as for or while loops when a certain condition is met$allowing the loop to end before it has iterated through all its elements or completed all its iterations.@#@#Here's how the break statement works:@#@#1)Inside a for loop:@#  >>for item in iterable:@#              if condition:@#                     break@#      # Code here executes for each item until the condition is met@#2)Inside a while loop:@#  >>while condition:@#               if another_condition:@#                       break@#       # Code here executes until another_condition is met$at which point the loop exits@#When Python encounters the break statement$it immediately exits the innermost loop and continues with the next statement after the loop. If the break statement is inside nested loops$it only exits the innermost loop.@#@#Here's a simple example to illustrate the usage of the break statement:@#  >>for i in range(10):@#               print(i)@#               if i == 5:@#                     break@#In this example$the loop iterates from 0 to 9. When i reaches 5$the condition i == 5 becomes true$and the break statement is executed. As a result$the loop terminates prematurely$and the program moves on to the next statement after the loop. Without the break statement$the loop would continue until it iterates through all numbers from 0 to 9.
continue,"continue statement: @#In Python$""continue"" is a keyword used within loops to skip the current iteration and proceed to the next one. When encountered$it jumps to the next iteration without executing the remaining code within the loop for that specific iteration.","The continue statement$borrowed from C$continues with the next iteration of the loop. For example:@#@#for num in range(2$10):@#    if num % 2 == 0:@#        print(""Found an even number""$num)@#        continue@#    print(""Found an odd number""$num)@#@#Outputs:@#@#Found an even number 2@#Found an odd number 3@#Found an even number 4@#Found an odd number 5@#Found an even number 6@#Found an odd number 7@#Found an even number 8@#Found an odd number 9"
pass, the `pass` statement in Python is a no-operation placeholder. It's used when a statement is syntactically required but no action is needed. It's commonly employed in situations like empty functions$classes$loops$or conditional blocks$serving as a temporary placeholder until actual code is added.,In Python$the pass statement is a null operation; nothing happens when it is executed. It is used when a statement is required syntactically but you don't want any command or code to execute.@#@#>> if condition:@#    pass  # This block does nothing@#else:@#    # Do something else@#This can be useful as a placeholder when you're writing code and you want to keep the structure intact but haven't yet implemented the functionality within a block.
match$pattern match,Pattern matching in Python$introduced in version 3.10$allows for concise conditional branching and value extraction from data structures like lists and dictionaries. It simplifies code by enabling direct matching of values$variable bindings$pattern-based matching$and guard clauses.,"@#@#A match statement takes an expression and compares its value to successive patterns given as one or more case blocks. This is similar to a switch statement in C$Java$or JavaScript$but it’s more akin to pattern matching in languages like Rust or Haskell. Only the first pattern that matches gets executed$and it can also extract components (sequence elements or object attributes) from the value into variables.@#@#The simplest form compares a subject value against one or more literals:@#@#def http_error(status):@#    match status:@#        case 400:@#            return ""Bad request""@#        case 404:@#            return ""Not found""@#        case 418:@#            return ""I'm a teapot""@#        case _:@#            return ""Something's wrong with the internet""@#@#Note the last block: the ""variable name"" `_` acts as a wildcard and never fails to match. If no case matches$none of the branches is executed."
Defining Function$define function$declare function$declaring function$create function$creating function$make function$making function$Defining Functions$define functions$declare functions$declaring functions$create functions$creating functions$make functions$making functions$function definition,Functions in Python are reusable blocks of code defined using the `def` keyword. They allow you to break down tasks into smaller$manageable pieces$improving code organization and reusability. Functions can accept input parameters$return values$have default parameters$and support variable numbers of arguments. They play a crucial role in modularizing code and enhancing readability.,In Python$a function is a block of reusable code that performs a specific task. Functions allow you to break down your program into smaller$manageable pieces$making your code more organized$easier to understand$and more maintainable. Here's a breakdown of the key concepts related to functions in Python:@#@#Defining a Function: To define a function in Python$you use the def keyword followed by the function name and parentheses ( )$which may include parameters (arguments) if the function accepts input. The function body is indented below the def statement.@#>>def my_function(parameter1$parameter2):@#    # Function body@#    # Code goes here@#Calling a Function: To execute a function and perform its task$you call the function by using its name followed by parentheses ( )$optionally passing arguments if the function expects them.@#>>my_function(value1$value2)@#Return Statement: Functions in Python may return a value using the return statement. This allows the function to compute a result and pass it back to the caller.@#>>def add(x$y):@#    return x + y
Special parameters$Special parameter,By default$arguments may be passed to a Python function either by position or explicitly by keyword. For readability and performance$it makes sense to restrict the way arguments can be passed so that a developer need only look at the function definition to determine if items are passed by position$by position or keyword$or by keyword.@#@#A function definition may look like:@#@#def f(pos1$pos2$/$pos_or_kwd$*$kwd1$kwd2):@#      -----------    ----------     ----------@#        |             |                  |@#        |        Positional or keyword   |@#        |                                - Keyword only@#         -- Positional only@#where$and * are optional. If used$these symbols indicate the kind of parameter by how the arguments may be passed to the function: positional-only$positional-or-keyword$and keyword-only. Keyword parameters are also referred to as named parameters.,By default$arguments may be passed to a Python function either by position or explicitly by keyword. For readability and performance$it makes sense to restrict the way arguments can be passed so that a developer need only look at the function definition to determine if items are passed by position$by position or keyword$or by keyword.@#@#A function definition may look like:@#@#def f(pos1$pos2$/$pos_or_kwd$*$kwd1$kwd2):@#      -----------    ----------     ----------@#        |             |                  |@#        |        Positional or keyword   |@#        |                                - Keyword only@#         -- Positional only@#where$and * are optional. If used$these symbols indicate the kind of parameter by how the arguments may be passed to the function: positional-only$positional-or-keyword$and keyword-only. Keyword parameters are also referred to as named parameters.
Lexical analysis,Lexical analysis in Python is the process of breaking source code into tokens like keywords$identifiers$and literals. It's the initial phase of compilation$where characters are scanned and grouped based on predefined rules$forming the basis for further processing.,Lexical analysis$often referred to as lexing$is the initial phase of Python's compilation process. It involves breaking the source code into a sequence of tokens$which are the smallest meaningful units such as keywords$identifiers$literals$operators$and punctuation symbols. Python's lexer scans through the source code character by character$identifying these tokens based on predefined rules$like whitespace or special characters delineating tokens. The output of lexical analysis is a stream of tokens that forms the input for the subsequent stages of the Python compiler$like parsing and interpretation.
Line structure$Lines structure,A Python program is divided into a number of logical lines.,A Python program is segmented into several logical lines.
Logical lines$logical line,In Python$logical lines are lines of code treated as individual statements by the interpreter. They can span multiple physical lines if separated by line continuation characters or contained within parentheses$brackets$or braces.,In Python$logical lines represent lines of code that the interpreter treats as separate statements. Unlike many other languages$Python does not require explicit statement terminators like semicolons. Instead$it uses indentation to denote the beginning and end of blocks of code. A single physical line can contain one or more logical lines if they're separated by explicit line continuation characters like backslashes (`\`) or are contained within parentheses$brackets$or braces$without needing explicit line continuation.
Physical lines$physical line,In Python$physical lines are the lines of code as they appear in the script or file$usually corresponding to individual statements$but they can be continued onto multiple lines using backslashes or contained within parentheses$brackets$or braces.,In Python$physical lines refer to the actual lines of code as they appear in the script or file. Each physical line typically corresponds to a single statement$but a statement can span multiple physical lines if it's broken using a line continuation character `\` or if it's contained within parentheses$brackets$or braces. Physical lines are what you see when you open a Python script or file in a text editor.
Comments$comment,In Python$comments are annotations within the code that are ignored by the interpreter but provide valuable explanations or context to human readers. They start with the `#` symbol and can be placed on their own line or at the end of a line of code. Comments help document code$clarify its purpose$and make it easier to understand and maintain.,A comment begins with a hash character (#) that is not within a string literal and continues until the end of the line. It marks the end of the logical line unless implicit line joining rules are at play. Comments are disregarded by the syntax.
Explicit joining,Explicit line joining in Python is achieved by using the backslash (`\`) at the end of each line to continue a single logical line across multiple physical lines$helpful for improving code readability when a statement is too long to fit on one line.,Explicit line joining in Python allows you to continue a single logical line of code across multiple physical lines. This is achieved by using the backslash (\) character at the end of each line that you want to join. It's typically used when a single statement is too long to fit on one line for readability purposes. For example:@#>>result = 10 + \@#         20 + \@#         30@#Here$the backslashes indicate that the addition operation continues onto the next line$forming a single logical line.
Implicit joining,In Python$implicit line joining allows certain constructs to span multiple lines without the need for explicit line continuation characters like backslashes. For instance$expressions within parentheses$square brackets$or curly braces can automatically continue onto the next line. This feature enhances code readability and reduces the need for explicit line continuation in certain contexts.,Expressions in parentheses$square brackets or curly braces can be split over more than one physical line without using backslashes. For example:@#@#month_names = ['Januari'$'Februari'$'Maart'$    # These are the@#               'April'$ 'Mei'$    'Juni'$     # Dutch names@#               'Juli'$  'Augustus'$'September'$# for the months@#               'Oktober'$'November'$'December']   # of the year@#Implicitly continued lines can carry comments. The indentation of the continuation lines is not important. Blank continuation lines are allowed. There is no NEWLINE token between implicit continuation lines. Implicitly continued lines can also occur within triple-quoted strings (see below); in that case they cannot carry comments.
line joining$lines joining,Explicit line joining in Python is achieved by using the backslash (`\`) at the end of each line to continue a single logical line across multiple physical lines$helpful for improving code readability when a statement is too long to fit on one line.@#@#In Python$implicit line joining allows certain constructs to span multiple lines without the need for explicit line continuation characters like backslashes. For instance$expressions within parentheses$square brackets$or curly braces can automatically continue onto the next line. This feature enhances code readability and reduces the need for explicit line continuation in certain contexts.,Explicit line joining in Python allows you to continue a single logical line of code across multiple physical lines. This is achieved by using the backslash (\) character at the end of each line that you want to join. It's typically used when a single statement is too long to fit on one line for readability purposes. For example:@#>>result = 10 + \@#         20 + \@#         30@#Here$the backslashes indicate that the addition operation continues onto the next line$forming a single logical line.@#@#Expressions in parentheses$square brackets or curly braces can be split over more than one physical line without using backslashes. For example:@#@#month_names = ['Januari'$'Februari'$'Maart'$    # These are the@#               'April'$ 'Mei'$    'Juni'$     # Dutch names@#               'Juli'$  'Augustus'$'September'$# for the months@#               'Oktober'$'November'$'December']   # of the year@#Implicitly continued lines can carry comments. The indentation of the continuation lines is not important. Blank continuation lines are allowed. There is no NEWLINE token between implicit continuation lines. Implicitly continued lines can also occur within triple-quoted strings (see below); in that case they cannot carry comments.
Blank lines$blank line,A logical line that contains only spaces$tabs$formfeeds and possibly a comment$is ignored (i.e.$no NEWLINE token is generated). During interactive input of statements$handling of a blank line may differ depending on the implementation of the read-eval-print loop. In the standard interactive interpreter$an entirely blank logical line (i.e. one containing not even whitespace or a comment) terminates a multi-line statement.,A logical line that includes only spaces$tabs$formfeeds$and possibly a comment is not considered (i.e.$no NEWLINE token is produced). When interacting with input statements$how a blank line is handled may vary depending on the implementation of the read-eval-print loop. In the standard interactive interpreter$a completely empty logical line (one without any whitespace or a comment) ends a multi-line statement.
