keywords,answer1,answer2
while statement$while loop$while looping$while iteration,The while loop in Python executes a block of code repeatedly as long as a specified condition remains True. It starts with the while keyword followed by a condition. The code block is executed as long as the condition evaluates to True$and the condition is re-evaluated after each iteration.,The while loop in Python is used to repeatedly execute a block of code as long as a specified condition is True. Here's how it works:@#@#1)Syntax: The while loop starts with the while keyword$followed by a condition. The code block to be executed is indented below the while statement.@#  >>while condition:@#        # code block@#2)Condition: The condition is a boolean expression that determines whether the loop should continue iterating. If the condition evaluates to True$the code block inside the loop is executed. If the condition evaluates to False$the loop terminates$and the program continues executing the code after the loop.@#3)Iterating: Inside the loop$the code block is executed repeatedly as long as the condition remains True. After each iteration$the condition is re-evaluated. If the condition is still True$the loop continues to execute. If the condition becomes False at any point$the loop terminates$and control passes to the next statement after the loop.@#Example:@#  >>count = 0@#      while count < 5:@#           print(count)@#           count += 1@#This loop prints numbers from 0 to 4. The count variable starts at 0$and the loop continues executing as long as count is less than 5. Inside the loop$the current value of count is printed$and then count is incremented by 1. Once count reaches 5$the condition count < 5 becomes False$and the loop terminates.@#while loops are useful when you need to repeatedly execute a block of code until a certain condition is met. However$you should be cautious to ensure that the condition eventually becomes False to prevent infinite loops$which can cause your program to hang or become unresponsive.
infinite loop$infinite recursion,An infinite loop or recursion in Python occurs when a loop continues to execute indefinitely without ever terminating. This can happen due to missing or incorrect exit conditions$or if the exit condition is not being updated within the loop. Infinite loops can cause your program to hang or become unresponsive.,"An infinite loop or recursion in Python is a loop that continues to execute indefinitely without ever terminating. This situation occurs when the loop's exit condition is never met or when the loop's exit condition is not properly defined. Here's how infinite loops can happen:@#@#1)Missing or Incorrect Exit Condition: If the exit condition of a loop is not properly defined or if it's missing altogether$the loop will continue executing indefinitely.@#  >># Infinite loop: Missing exit condition@#      while True:@#           print(""This is an infinite loop"")@#2)Exit Condition Not Being Updated: Even if an exit condition is defined initially$if it's not being updated within the loop$the loop may continue to execute indefinitely.@#  >># Infinite loop: Exit condition not being updated@#       count = 0@#       while count < 5:@#            print(""This is an infinite loop"")@#3)Incorrect Logic: Incorrect logic within the loop can also lead to infinite loops. For example$if the logic for updating a loop variable or condition is incorrect$the loop may not terminate as expected.@#  >># Infinite loop: Incorrect logic for updating loop variable@#       count = 0@#       while count < 5:@#            print(count)@#       # Incorrect logic: Count never gets updated$loop continues indefinitely@#Infinite loops can cause your program to hang or become unresponsive$as it keeps executing the same code repeatedly without making progress. To avoid infinite loops$ensure that the exit condition of your loops is properly defined and updated within the loop's code block. Additionally$be cautious when using constructs like while True$and make sure there's a clear termination condition."
assignment operators$augmented operators,Augmented assignment operators in Python are shortcuts for performing arithmetic or bitwise operations while simultaneously assigning the result back to a variable. They combine an operator (like +=$-=$*=$etc.) with the assignment operator (=) to update the variable's value in-place.,Augmented assignment operators in Python are shorthand notation for performing arithmetic or bitwise operations while simultaneously assigning the result back to the variable. They combine an arithmetic or bitwise operator with the assignment operator (=). Here are some common augmented assignment operators:@#@#1)+=: Adds the value of the right operand to the variable and assigns the result back to the variable.@#  >>x += 5  # Equivalent to: x = x + 5@#2)-=: Subtracts the value of the right operand from the variable and assigns the result back to the variable.@#  >>x -= 3  # Equivalent to: x = x - 3@#3)*=: Multiplies the variable by the value of the right operand and assigns the result back to the variable.@#  >>x *= 2  # Equivalent to: x = x * 2@#4)/=: Divides the variable by the value of the right operand and assigns the result back to the variable.@#  >>x /= 4  # Equivalent to: x = x$4@#5)%=: Performs the modulo operation on the variable with the value of the right operand and assigns the remainder back to the variable@#  >>x %= 3  # Equivalent to: x = x % 3@#6)//=: Performs integer division on the variable with the value of the right operand and assigns the quotient back to the variable.@#  >>x //= 2  # Equivalent to: x = x // 2@#7)**=: Raises the variable to the power of the value of the right operand and assigns the result back to the variable.@#  >>x **= 3  # Equivalent to: x = x ** 3@#8)&=$|=: Performs bitwise AND or OR operation on the variable with the value of the right operand and assigns the result back to the variable.@#  >>x &= 0b1010  # Equivalent to: x = x & 0b1010@#      x |= 0b1100  # Equivalent to: x = x | 0b1100@#Augmented assignment operators are concise and efficient ways to update variables by performing operations in-place. They can improve code readability and reduce redundancy$especially when multiple operations are performed on the same variable.
nested loops$nested loop,Nested loops in Python are loops within loops. They allow you to iterate over elements in multiple dimensions or perform repetitive tasks hierarchically. The inner loop executes completely for each iteration of the outer loop.,"Nested loops in Python refer to the situation where you have one loop inside another loop. This allows you to iterate over elements in multiple dimensions or to perform repetitive tasks in a hierarchical manner. Here's how they work:@#@#1)Syntax: In Python$you can place one loop inside another by indenting the inner loop within the block of the outer loop.@#  >>for outer_item in outer_sequence:@#               for inner_item in inner_sequence:@#                 # Code block@#2)Execution: The outer loop executes first$and for each iteration of the outer loop$the inner loop executes completely. This means that the inner loop iterates through all its elements for each iteration of the outer loop.@#Example:@#  >>for i in range(3):@#          for j in range(2):@#                print(f""({i}${j})"")@#This code will produce the following output:@#(0$0)@#(0$1)@#(1$0)@#(1$1)@#(2$0)@#(2$1)@#In this example$the outer loop iterates over the values 0$1$and 2$while the inner loop iterates over the values 0 and 1 for each value of the outer loop.@#Nested loops are commonly used when dealing with multi-dimensional data structures like matrices or nested lists$or when performing repetitive tasks that involve multiple levels of iteration. However$it's important to be cautious with nested loops$as they can result in increased complexity and execution time$especially for large data sets."
void function,"A ""void function"" in Python is a function that doesn't return any value or explicitly returns None. It typically performs an action or task but doesn't produce a result that can be used elsewhere in the code.","In Python$a ""void function"" is a term that is not commonly used. However$it likely refers to a function that doesn't return any value$or more precisely$returns the value None. In Python$functions that don't have a return statement or have a return statement without a value explicitly specified return None by default.@#@#Here's an example of a void function:@#  >>def greet(name):@#           print(f""Hello${name}!"")@#          result = greet(""Alice"")@#          print(result)  # Output: None@#In this example$the greet function prints a greeting message but doesn't explicitly return any value. When we assign the result of calling greet(""Alice"") to a variable and print it$we get None$indicating that the function returned nothing.@#@#So$in summary$a ""void function"" in Python typically refers to a function that doesn't return any meaningful value$but rather performs some action or task."
value returning function$value-returning function,A value-returning function in Python is a function that calculates a result and returns it to the caller using the return statement. It produces a value that can be assigned to a variable or used in expressions elsewhere in the program.,A value-returning function in Python is a function that calculates and returns a result or value to the caller. Unlike void functions$which perform actions without returning a value$value-returning functions produce a result that can be used in the program.@#@#Here's an example of a value-returning function:@#  >>def add(a$b):@#           return a + b@#result = add(3$5)@#print(result)  # Output: 8@#In this example$the add function takes two arguments a and b$adds them together using the + operator$and returns the result using the return statement. When we call add(3$5)$it returns 8$which is then assigned to the variable result and printed.@#@#Value-returning functions are commonly used in Python to perform calculations$process data$or perform any operation that needs to produce a result that can be used elsewhere in the program.
local variable$local variables,In Python$a local variable is a variable defined within a function's scope$accessible only within that function. It exists only during the function's execution and cannot be accessed from outside the function.,In Python$a local variable is a variable defined within a function$which can only be accessed within that function's scope. Local variables are created when a function is called$and they exist only for the duration of that function's execution. Here are some key points about local variables:@#@#1)Scope: Local variables have local scope$meaning they are only accessible within the function in which they are defined. They cannot be accessed from outside the function.@#2)Lifetime: Local variables are created when the function is called and destroyed when the function exits. They do not persist beyond the function's execution.@#3)Name Conflicts: Local variables can have the same name as variables in other functions or in the global scope without causing conflicts. Each function's local variables are independent of variables with the same name in other functions.@#Example:@#  >>def my_function():@#              x = 10  # Local variable@#              print(x)@#my_function()  # Output: 10@## print(x)  # This would cause a NameError: name 'x' is not defined@#In this example$x is a local variable defined within the my_function() function. It can only be accessed within the function.@#@#Local variables provide encapsulation and help organize code by keeping data separate and accessible only to the functions that need it. They also prevent unintended modifications of variables in other parts of the program.
keyword arguments$keyword argument,Keyword arguments in Python allow you to pass arguments to a function using parameter names. This provides clarity$flexibility$and allows you to specify only the arguments you need$especially useful for functions with many parameters.,"In Python$keyword arguments allow you to specify arguments to a function using the parameter names along with their corresponding values. This provides clarity and flexibility$especially when dealing with functions that have many parameters or when you want to pass arguments in a different order than they are defined.@#@#Here's a basic example:@#  >>def greet(name$message):@#              print(f""Hello${name}! {message}"")@#           # Calling the function using positional arguments@#       greet(""Alice""$""How are you?"")@#@#               # Calling the function using keyword arguments@#             greet(message=""How are you?""$name=""Bob"")@#In the first call$""Alice"" is passed as the name argument and ""How are you?"" as the message argument. In the second call$the arguments are passed in a different order$but because they are explicitly named$Python can still match them correctly.@#@#Keyword arguments become particularly useful when functions have many parameters and you only want to specify a few of them$or when you want to make your code more readable by explicitly stating what each argument represents.@#@#You can also set default values for parameters$which further enhances the flexibility of keyword arguments:@#  >>def greet(name$message=""How are you?""):@#                   print(f""Hello${name}! {message}"")@#       # Now$you can call greet with just the name@#       greet(""Alice"")@#      # Or with both name and message@#      greet(""Bob""$""Nice to see you!"")@#In this example$if you call greet(""Alice"")$it will print ""Hello$Alice! How are you?"" because the default value for message is used. But if you call greet(""Bob""$""Nice to see you!"")$it will print ""Hello$Bob! Nice to see you!""$overriding the default value for message."
default argument$default arguments,Default argument values in Python allow you to set a default value for a function parameter. If no value is provided when the function is called$it uses this default value$making the parameter optional.,"In Python$default argument values allow you to set a default value for a function parameter. If an argument isn't provided when the function is called$it uses this default value. This feature enhances flexibility$making certain parameters optional. Here's a quick example:@#  >>def greet(name$message=""How are you?""):@#               print(f""Hello${name}! {message}"")  @#        # You can call greet with just the name@#        greet(""Alice"")@#        # Or with both name and message@#        greet(""Bob""$""Nice to see you!"")@#In this code$message has a default value of ""How are you?"". When you call greet(""Alice"")$it prints ""Hello$Alice! How are you?"" because message defaults to its default value. But when you call greet(""Bob""$""Nice to see you!"")$it prints ""Hello$Bob! Nice to see you!""$overriding the default value for message."
open file&open files,"To open a file in Python$you use the open() function$specifying the file name and the mode (""r"" for read$""w"" for write$""a"" for append). After you're done$it's important to close the file using file.close() or use a context manager (with open() as file:) to automatically handle closing.","In Python$you can open a file using the built-in open() function. Here's a basic example:@#  >># Open a file in read mode@#      file = open(""example.txt""$""r"")@#      # Read the contents of the file@#       contents = file.read()@#       # Close the file@#        file.close()@#In this example:@#@#""example.txt"" is the name of the file you want to open. You can specify the file path if it's not in the same directory as your Python script.@#""r"" specifies the mode in which the file is opened. ""r"" stands for read mode$which allows you to read the contents of the file. Other common modes include ""w"" for write mode (creating a new file or overwriting an existing one) and ""a"" for append mode (appending data to the end of an existing file).@#After you've finished working with the file$it's important to close it using the close() method to free up system resources.@#@#Alternatively$you can use a context manager (with statement) to automatically close the file when you're done:@#  >>with open(""example.txt""$""r"") as file:@#         contents = file.read()@#Using a context manager ensures that the file is closed properly$even if an exception occurs within the with block."
file modes,"Sure! In Python$file modes indicate how you want to interact with a file. ""r"" is for reading$""w"" for writing (truncates existing content)$""a"" for appending$""b"" for binary mode$and ""t"" for text mode (default). You can combine modes$like ""rb"" for reading a binary file.","In Python$when opening a file using the open() function$you can specify different modes to indicate how you intend to interact with the file. Here are the main modes:@#@#1)""r"": Read mode. Opens the file for reading. If the file doesn't exist$it raises a FileNotFoundError.@#2)""w"": Write mode. Opens the file for writing. If the file exists$it truncates (clears) its content. If it doesn't exist$it creates a new file.@#3)""a"": Append mode. Opens the file for writing$but appends new data to the end of the file without truncating existing content. If the file doesn't exist$it creates a new file.@#4)""b"": Binary mode. Opens the file in binary mode$which is used when working with non-text files like images or executable files. It can be combined with other modes$like ""rb"" for reading binary files.@#5)""t"": Text mode (default). Opens the file in text mode$which is used for working with text files. It's often used in combination with other modes$like ""rt"" for reading text files.@#@#These modes can be combined as needed. For example$""r+"" opens the file for both reading and writing$while ""a+"" opens the file for both appending and reading. If you omit the mode$""r"" is assumed by default. Remember to handle file closing properly after you're done with it$either by calling file.close() or using a context manager (with open() as file:)."
write file,"Certainly! To write data to a file in Python$open the file in write mode (""w"")$use write() to add content$and remember to close the file. Example:@#  >>with open(""output.txt""$""w"") as file:@#                file.write(""Hello$world!\nThis is a new line."")","Writing data to a file in Python involves opening the file in write mode (""w"") or append mode (""a"")$then using methods like write() to add content to the file. Here's a basic example:@#  >># Open a file in write mode@#       with open(""output.txt""$""w"") as file:@#      # Write data to the file@#                file.write(""Hello$world!\n"")@#                file.write(""This is a new line."")@#In this example:@#@#""output.txt"" is the name of the file you want to write to.@#""w"" specifies the write mode$which truncates (clears) existing content and creates a new file if it doesn't exist. Use ""a"" for append mode if you want to add data without clearing existing content.@#The write() method is used to add content to the file. Each call to write() adds data to the file without adding newlines automatically$so you need to add newline characters (\n) explicitly if you want them.@#After executing this code$the file ""output.txt"" will contain:@#  >>Hello$world!@#      This is a new line.@#Remember to handle exceptions that may occur during file writing$and always close the file properly after writing to it$either by calling file.close() or using a context manager (with open() as file:)."
read file,"To read data from a file in Python$open the file in read mode (""r"")$use methods like read() to read the entire content as a string$or readline() to read one line at a time. Example:@#  >>with open(""input.txt""$""r"") as file:@#             content = file.read()  # Reads entire content as a string","Reading data from a file in Python involves opening the file in read mode (""r"") and using methods like read()$readline()$or readlines() to access the file's contents. Here's a basic example:@#  >># Open a file in read mode@#        with open(""input.txt""$""r"") as file:@#                # Read the entire content of the file@#                 content = file.read()@#In this example:@#""input.txt"" is the name of the file you want to read from.@#""r"" specifies the read mode$allowing you to access the file's content.@#The read() method reads the entire content of the file as a single string.@#After executing this code$the variable content will contain the content of the file ""input.txt"". You can also use readline() to read one line at a time or readlines() to read all lines into a list.@#@#Remember to handle exceptions that may occur during file reading$and always close the file properly after reading from it$either by calling file.close() or using a context manager (with open() as file:)."
finally clause$the finally clause$finally exception, In Python$the finally clause is used for cleanup actions that should always be performed$regardless of whether an exception occurs or not. It ensures certain code is executed$such as closing files or releasing resources$after a try block$even if an exception is raised.,"In Python$the finally clause is used in exception handling alongside try and except. It's a block of code that is always executed$regardless of whether an exception occurs or not. This is useful for cleanup actions$such as closing files or releasing resources$that should always be performed$regardless of whether an exception is raised. Here's a basic example:@#  >>try:@#             # Code that may raise an exception@#             file = open(""example.txt""$""r"")@#             content = file.read()@#             # Some other operations@#      except FileNotFoundError:@#             # Handle specific exceptions@#             print(""File not found!"")@#      finally:@#             # This block is always executed$regardless of exceptions@#             if 'file' in locals():@#                  file.close()  # Close the file@#In this example$even if an exception occurs while trying to read the file$the finally block ensures that the file is closed properly. This ensures that resources are released correctly$promoting clean and robust code."
append method$append function$append(),In Python$the append() method adds an element to the end of a list. It modifies the original list in place. Example: my_list.append(4) adds `4,In Python$the append() method is used to add an element to the end of a list. Here's a basic example:@#  >>my_list = [1$2$3]@#      my_list.append(4)@#      print(my_list)  # Output: [1$2$3$4]@#In this example$append(4) adds the integer 4 to the end of the list my_list. The list is modified in place$meaning the original list is changed.@#@#You can also use append() to add another list as a single element at the end:@#  >>my_list = [1$2$3]@#       my_list.append([4$5])@#       print(my_list)  # Output: [1$2$3$[4$5]]@#Here$[4$5] is added as a single element to the end of my_list.@#Remember$append() only adds one element to the end of the list. If you want to add multiple elements$you can use extend() or the + operator.
index method$index function$index(),In Python$the index() method finds the index of the first occurrence of a specified value in a list. Syntax: my_list.index(value). It raises a ValueError if the value is not found.,In Python$the index() method is used to find the index of the first occurrence of a specified value in a list. Here's a basic example:@#  >>my_list = [1$2$3$4$2]@#      index = my_list.index(2)@#      print(index)  # Output: 1@#In this example$index(2) returns the index of the first occurrence of 2 in my_list$which is 1 (indexes in Python are zero-based).@#@#If the specified value is not found in the list$the index() method raises a ValueError:@#  >>my_list = [1$2$3$4$2]@#      index = my_list.index(5)  # ValueError: 5 is not in list@#You can also specify a start and stop index to search within a specific range:@#  >>my_list = [1$2$3$4$2]@#      index = my_list.index(2$2$5)@#      print(index)  # Output: 4@#Here$index(2$2$5) searches for 2 starting from index 2 up to (but not including) index 5$returning 4 as the index of the first occurrence of 2 within that range.@#@#Remember$the index() method only returns the index of the first occurrence of the specified value. If you want to find all occurrences$you may need to use a loop or list comprehension.
remove method$remove function$remove(),In Python$the remove() method removes the first occurrence of a specified value from a list. Syntax: my_list.remove(value). It raises a ValueError if the value is not found.,In Python$the remove() method is used to remove the first occurrence of a specified value from a list. Here's a basic example:@#  >>my_list = [1$2$3$4$2]@#      my_list.remove(2)@#      print(my_list)  # Output: [1$3$4$2]@#In this example$remove(2) removes the first occurrence of 2 from my_list.@#@#If the specified value is not found in the list$the remove() method raises a ValueError:@#  >>my_list = [1$3$4]@#      my_list.remove(2)  # ValueError: list.remove(x): x not in list@#It's important to note that remove() modifies the original list in place. If the value occurs multiple times in the list$only the first occurrence will be removed.@#  >>my_list = [1$2$2$3]@#      my_list.remove(2)@#      print(my_list)  # Output: [1$2$3]@#Here$only the first occurrence of 2 is removed$leaving the second one intact.@#@#Remember$if you want to remove an element at a specific index$you can use the del statement or the pop() method.
