keywords,answer1,answer2
overflow error,Raised when the result of an arithmetic operation is too large to be represented. This cannot occur for integers (which would rather raise memory error thn give up) . However$for historical reasons$OverflowError is sometimes raised for integers that are outside a required range. Because of the lack of standardization of floating point exception handling in C$most floating point operations are not checked.,In Python$an OverflowError occurs when a calculation exceeds the maximum limit that can be represented by a numeric data type. This typically happens when performing arithmetic operations that result in a value larger than the maximum value that can be stored in the given data type.@#@#For example$consider the following code:@#  >>x = 10 ** 1000  # Attempting to calculate 10 to the power of 1000@#        print(x)@#Output:@#  >>OverflowError: int too large to convert to float@#In this example$attempting to calculate 10 to the power of 1000 results in an OverflowError because the resulting value is too large to be represented by the Python int type.@#@#Similarly$performing arithmetic operations that result in values outside the range of a given numeric type can also raise OverflowError. For example$adding two very large numbers together or dividing by zero in certain cases can lead to an OverflowError.@#@#To prevent OverflowError:@#@#1)Use appropriate data types or libraries that support arbitrary precision arithmetic for handling very large numbers.@#2)Check for potential overflow conditions and handle them gracefully in your code$such as by using try-except blocks to catch and handle OverflowError.
file exists error,Raised when trying to create a file or directory which already exists.,"In Python$a FileExistsError is raised when attempting to create a file or directory that already exists. This error typically occurs when using functions or methods that create files or directories$such as open() for file creation or os.makedirs() for directory creation$in situations where the specified file or directory already exists in the file system.@#@#For example$consider the following code:@#  >>with open(""myfile.txt""$""x"") as f:@#                f.write(""Hello$world!"")@#If myfile.txt already exists in the current directory$attempting to create it again with the ""x"" mode (exclusive creation) will raise a FileExistsError because the file cannot be created if it already exists.@#@#To handle FileExistsError$you can:@#@#Check if the file or directory already exists before attempting to create it.@#Use appropriate file opening or directory creation modes that allow for existing files or directories to be overwritten or ignored$depending on your specific requirements.@#Use try-except blocks to catch and handle FileExistsError exceptions gracefully in your code."
file not found,Raised when a file or directory is requested but doesn’t exist.,"In Python$a FileNotFoundError is raised when attempting to access or open a file that does not exist in the specified location. This error typically occurs when using functions or methods that require accessing files$such as open() for file reading or os.remove() for file deletion$but the specified file path does not point to an existing file.@#@#For example$consider the following code:@#  >>with open(""myfile.txt""$""r"") as f:@#           content = f.read()@#If myfile.txt does not exist in the current directory$attempting to open it for reading (""r"" mode) will raise a FileNotFoundError because the file cannot be found at the specified path.@#@#To handle FileNotFoundError$you can:@#@#Ensure that the file path is correct and points to the intended file.@#Check if the file exists before attempting to access it using functions like os.path.exists() or os.path.isfile().@#Use try-except blocks to catch and handle FileNotFoundError exceptions gracefully in your code$providing appropriate error messages or fallback behaviors for when the file is not found."
 syntax warning,Base class for warnings about dubious syntax.,"In Python$a SyntaxWarning is issued by the interpreter when it encounters a dubious or potentially incorrect syntax construct in the code. Unlike other exceptions or errors$SyntaxWarning does not typically halt the execution of the program$but it serves as an indicator of potential issues in the code.@#@#SyntaxWarning often occurs in situations where the code follows syntactic conventions that are not recommended or are considered non-standard$but they are technically valid according to the Python language specifications. These warnings are intended to draw attention to code that might be confusing or lead to unexpected behavior.@#@#For example$using the <> operator for inequality instead of !=:@#  >># Deprecated syntax for inequality@#        if x <> y:@#               print(""x is not equal to y"")@#This would generate a SyntaxWarning because <> is deprecated and != is the preferred way to express inequality in Python.@#@#To handle SyntaxWarning:@#@#Review the code to identify and correct any syntax constructs that might trigger SyntaxWarning.@#Pay attention to any warnings issued by the interpreter during code execution or use tools like static code analyzers to detect potential issues.@#Suppress or ignore SyntaxWarning if you are intentionally using non-standard syntax and are aware of its implications. However$it's generally recommended to adhere to standard Python syntax conventions to ensure code clarity and maintainability."
cmath,This module provides access to mathematical functions for complex numbers. The functions in this module accept integers$floating-point numbers or complex numbers as arguments. They will also accept any Python object that has either a __complex__() or a __float__() method: these methods are used to convert the object to a complex or floating-point number$respectively$and the function is then applied to the result of the conversion.,This module provides access to mathematical functions for complex numbers. The functions in this module accept integers$floating-point numbers or complex numbers as arguments. They will also accept any Python object that has either a __complex__() or a __float__() method: these methods are used to convert the object to a complex or floating-point number$respectively$and the function is then applied to the result of the conversion.
cmath phase,Return the phase of x (also known as the argument of x)$as a float. phase(x) is equivalent to math.atan2(x.imag$ x.real). The result lies in the range [-π$ π]$and the branch cut for this operation lies along the negative real axis. The sign of the result is the same as the sign of x.imag$even when x.imag is zero:@#phase(complex(-1.0$0.0))@#3.141592653589793@#phase(complex(-1.0$-0.0))@#-3.141592653589793,Return the phase of x (also known as the argument of x)$as a float. phase(x) is equivalent to math.atan2(x.imag$ x.real). The result lies in the range [-π$ π]$and the branch cut for this operation lies along the negative real axis. The sign of the result is the same as the sign of x.imag$even when x.imag is zero:@#phase(complex(-1.0$0.0))@#3.141592653589793@#phase(complex(-1.0$-0.0))@#-3.141592653589793
exp,Return e raised to the power x$where e is the base of natural logarithms.,Return e raised to the power x$where e is the base of natural logarithms.
sqrt,Return the square root of x. This has the same branch cut as log().@#,Return the square root of x. This has the same branch cut as log().
cmath pi,The mathematical constant π$as a float.,The mathematical constant π$as a float.
cmath e,The mathematical constant e$as a float.,The mathematical constant e$as a float.
random,The random module in Python offers various functions for generating pseudo-random numbers across different distributions. It includes functions for selecting random integers from a range$choosing random elements from sequences$generating random permutations of lists$and sampling without replacement.@#@#Additionally$there are functions for generating random numbers on the real line$such as uniform$normal (Gaussian)$lognormal$negative exponential$gamma$and beta distributions. It also provides the von Mises distribution for generating angles.@#@#The core function random() generates random floats uniformly in the range 0.0 to just below 1.0. It relies on the Mersenne Twister algorithm$which produces 53-bit precision floats with a period of 2**19937-1. The implementation is efficient and thread-safe$making it widely used and tested. However$it's deterministic and unsuitable for cryptographic purposes.@#@#These functions are actually methods of a hidden instance of the random.Random class. You can create your own instances of Random for independent generators. The Random class can also be subclassed for custom generators.@#@#Furthermore$the random module offers the SystemRandom class$which uses os.urandom() to generate random numbers from the operating system's sources.,The random module in Python offers various functions for generating pseudo-random numbers across different distributions. It includes functions for selecting random integers from a range$choosing random elements from sequences$generating random permutations of lists$and sampling without replacement.@#@#Additionally$there are functions for generating random numbers on the real line$such as uniform$normal (Gaussian)$lognormal$negative exponential$gamma$and beta distributions. It also provides the von Mises distribution for generating angles.@#@#The core function random() generates random floats uniformly in the range 0.0 to just below 1.0. It relies on the Mersenne Twister algorithm$which produces 53-bit precision floats with a period of 2**19937-1. The implementation is efficient and thread-safe$making it widely used and tested. However$it's deterministic and unsuitable for cryptographic purposes.@#@#These functions are actually methods of a hidden instance of the random.Random class. You can create your own instances of Random for independent generators. The Random class can also be subclassed for custom generators.@#@#Furthermore$the random module offers the SystemRandom class$which uses os.urandom() to generate random numbers from the operating system's sources.
randint,Return a random integer N such that a <= N <= b. Alias for randrange(a$b+1).@#,Return a random integer N such that a <= N <= b. Alias for randrange(a$b+1).
random shuffle()$shuffle,Shuffle the sequence x in place.@#@#To shuffle an immutable sequence and return a new shuffled list$use sample(x$k=len(x)) instead.@#@#Note that even for small len(x)$the total number of permutations of x can quickly grow larger than the period of most random number generators. This implies that most permutations of a long sequence can never be generated. For example$a sequence of length 2080 is the largest that can fit within the period of the Mersenne Twister random number generator.,Shuffle the sequence x in place.@#@#To shuffle an immutable sequence and return a new shuffled list$use sample(x$k=len(x)) instead.@#@#Note that even for small len(x)$the total number of permutations of x can quickly grow larger than the period of most random number generators. This implies that most permutations of a long sequence can never be generated. For example$a sequence of length 2080 is the largest that can fit within the period of the Mersenne Twister random number generator.
random random(),Return the next random floating point number in the range 0.0 <= X < 1.0@#,Return the next random floating point number in the range 0.0 <= X < 1.0
csv,@#CSV (Comma Separated Values) is a widely used format for importing and exporting data in spreadsheets and databases. While there's no strict standard$attempts like RFC 4180 have been made to describe it. However$variations in delimiters and quoting characters can lead to subtle differences between data from different sources$making it challenging to process CSV files from multiple places.@#@#The csv module in Python helps in handling CSV data efficiently. It allows programmers to work with CSV data without worrying about its specific format. For example$they can easily write data in a format compatible with Excel or read data generated by Excel. The module also supports other CSV formats used by various applications or custom CSV formats tailored for specific needs.,@#CSV (Comma Separated Values) is a widely used format for importing and exporting data in spreadsheets and databases. While there's no strict standard$attempts like RFC 4180 have been made to describe it. However$variations in delimiters and quoting characters can lead to subtle differences between data from different sources$making it challenging to process CSV files from multiple places.@#@#The csv module in Python helps in handling CSV data efficiently. It allows programmers to work with CSV data without worrying about its specific format. For example$they can easily write data in a format compatible with Excel or read data generated by Excel. The module also supports other CSV formats used by various applications or custom CSV formats tailored for specific needs.
csv reader$read csv$csv reader(),@#To read a CSV file in Python$you can create a reader object that processes lines from the given file. The file must be iterable$with each line representing data in the CSV format defined by the reader. Typically$the file is a file-like object or a list of strings. If the file is a file object$it should be opened with the newline='' parameter.@#@#Optionally$you can specify a dialect parameter to define a set of parameters specific to a particular CSV dialect. This parameter can be an instance of a subclass of the Dialect class or one of the strings returned by the list_dialects() function. Additionally$you can provide other formatting parameters using the fmtparams keyword arguments to override individual parameters in the current dialect.@#@#Each row read from the CSV file is returned as a list of strings. By default$no automatic data type conversion is performed$unless the QUOTE_NONNUMERIC format option is specified$in which case unquoted fields are transformed into floats.@#A short usage example:@#@#>>>@#import csv@#with open('eggs.csv'$newline='') as csvfile:@#    spamreader = csv.reader(csvfile$delimiter=' '$quotechar='|')@#    for row in spamreader:@#        print('$'.join(row)),@#To read a CSV file in Python$you can create a reader object that processes lines from the given file. The file must be iterable$with each line representing data in the CSV format defined by the reader. Typically$the file is a file-like object or a list of strings. If the file is a file object$it should be opened with the newline='' parameter.@#@#Optionally$you can specify a dialect parameter to define a set of parameters specific to a particular CSV dialect. This parameter can be an instance of a subclass of the Dialect class or one of the strings returned by the list_dialects() function. Additionally$you can provide other formatting parameters using the fmtparams keyword arguments to override individual parameters in the current dialect.@#@#Each row read from the CSV file is returned as a list of strings. By default$no automatic data type conversion is performed$unless the QUOTE_NONNUMERIC format option is specified$in which case unquoted fields are transformed into floats.@#A short usage example:@#@#>>>@#import csv@#with open('eggs.csv'$newline='') as csvfile:@#    spamreader = csv.reader(csvfile$delimiter=' '$quotechar='|')@#    for row in spamreader:@#        print('$'.join(row))
csv writer$write csv$csv writer(),@#To write data into a CSV file in Python$you can create a writer object responsible for converting the user's data into delimited strings on the specified file-like object. The file-like object can be any object with a write() method$such as a file object. If the file-like object is a file object$it should be opened with the newline='' parameter.@#@#Optionally$you can specify a dialect parameter to define a set of parameters specific to a particular CSV dialect. This parameter can be an instance of a subclass of the Dialect class or one of the strings returned by the list_dialects() function. Additionally$you can provide other formatting parameters using the fmtparams keyword arguments to override individual parameters in the current dialect.@#@#To facilitate interfacing with modules implementing the DB API$the value None is written as an empty string. Although this transformation is not reversible$it simplifies dumping SQL NULL data values to CSV files without preprocessing the data returned from a cursor.fetch* call. All other non-string data are converted to strings using the str() function before being written.@#A short usage example:@#@#import csv@#with open('eggs.csv'$'w'$newline='') as csvfile:@#    spamwriter = csv.writer(csvfile$delimiter=' '$@#                            quotechar='|'$quoting=csv.QUOTE_MINIMAL)@#    spamwriter.writerow(['Spam'] * 5 + ['Baked Beans'])@#    spamwriter.writerow(['Spam'$'Lovely Spam'$'Wonderful Spam']),@#To write data into a CSV file in Python$you can create a writer object responsible for converting the user's data into delimited strings on the specified file-like object. The file-like object can be any object with a write() method$such as a file object. If the file-like object is a file object$it should be opened with the newline='' parameter.@#@#Optionally$you can specify a dialect parameter to define a set of parameters specific to a particular CSV dialect. This parameter can be an instance of a subclass of the Dialect class or one of the strings returned by the list_dialects() function. Additionally$you can provide other formatting parameters using the fmtparams keyword arguments to override individual parameters in the current dialect.@#@#To facilitate interfacing with modules implementing the DB API$the value None is written as an empty string. Although this transformation is not reversible$it simplifies dumping SQL NULL data values to CSV files without preprocessing the data returned from a cursor.fetch* call. All other non-string data are converted to strings using the str() function before being written.@#A short usage example:@#@#import csv@#with open('eggs.csv'$'w'$newline='') as csvfile:@#    spamwriter = csv.writer(csvfile$delimiter=' '$@#                            quotechar='|'$quoting=csv.QUOTE_MINIMAL)@#    spamwriter.writerow(['Spam'] * 5 + ['Baked Beans'])@#    spamwriter.writerow(['Spam'$'Lovely Spam'$'Wonderful Spam'])
python Instaltion$installing python$install python$download python,"Installing Python on your computer can vary slightly depending on your operating system. Here’s a general guide for Windows$macOS$and Linux:@#@#Windows@#Download Python:@#Go to the official Python website at https://www.python.org/.@#Click on ""Downloads"". The website usually suggests the best version for your Windows. For example$you might see ""Download Python 3.x.x"".@#Click the download link for Windows.@#Install Python:@#Run the downloaded executable file.@#Ensure you check the box that says ""Add Python 3.x to PATH"" at the bottom of the installer window to ensure that the interpreter will be placed in your execution path.@#Click ""Install Now"".@#After the installation is complete$click “Close”.@#Verify Installation:@#Open Command Prompt and type:@#python --version@#This should return the Python version number if Python was installed correctly.@#macOS@#Download Python:@#Go to python.org.@#Click on the ""Downloads"" for macOS and download the latest version.@#Install Python:@#Open the downloaded .pkg file and follow the installation instructions.@#Make sure to install pip along with Python$as it helps with installing and managing additional packages.@#Verify Installation:@#Open Terminal and type:@#python3 --version@#This should display the Python version installed.@#Linux@#Most Linux distributions come with Python pre-installed. However$if you need to install or upgrade Python$you can use the package manager provided by your distribution.@#@#Ubuntu/Debian:@#Open a terminal and enter:@#sudo apt update@#sudo apt install python3@#To install pip (Python package installer):@#sudo apt install python3-pip@#Fedora:@#Open a terminal and enter:@#sudo dnf install python3@#Verify Installation:@#Check the Python version by typing:@#python3 --version@#Post-Installation@#Once Python is installed$you can install additional packages using pip (Python's package installer). For example:@#pip install numpy@#This will install the NumPy package$which is useful for scientific computing with Python.@#@#By following these steps$you should be able to install Python on most systems and verify that it's ready for use.","Installing Python on your computer can vary slightly depending on your operating system. Here’s a general guide for Windows$macOS$and Linux:@#@#Windows@#Download Python:@#Go to the official Python website at python.org.@#Click on ""Downloads"". The website usually suggests the best version for your Windows. For example$you might see ""Download Python 3.x.x"".@#Click the download link for Windows.@#Install Python:@#Run the downloaded executable file.@#Ensure you check the box that says ""Add Python 3.x to PATH"" at the bottom of the installer window to ensure that the interpreter will be placed in your execution path.@#Click ""Install Now"".@#After the installation is complete$click “Close”.@#Verify Installation:@#Open Command Prompt and type:@#python --version@#This should return the Python version number if Python was installed correctly.@#macOS@#Download Python:@#Go to python.org.@#Click on the ""Downloads"" for macOS and download the latest version.@#Install Python:@#Open the downloaded .pkg file and follow the installation instructions.@#Make sure to install pip along with Python$as it helps with installing and managing additional packages.@#Verify Installation:@#Open Terminal and type:@#python3 --version@#This should display the Python version installed.@#Linux@#Most Linux distributions come with Python pre-installed. However$if you need to install or upgrade Python$you can use the package manager provided by your distribution.@#@#Ubuntu/Debian:@#Open a terminal and enter:@#sudo apt update@#sudo apt install python3@#To install pip (Python package installer):@#sudo apt install python3-pip@#Fedora:@#Open a terminal and enter:@#sudo dnf install python3@#Verify Installation:@#Check the Python version by typing:@#python3 --version@#Post-Installation@#Once Python is installed$you can install additional packages using pip (Python's package installer). For example:@#pip install numpy@#This will install the NumPy package$which is useful for scientific computing with Python.@#@#By following these steps$you should be able to install Python on most systems and verify that it's ready for use."
